{
  "schema_version": "1.0",
  "source": "fixture",
  "context_id": "AGENTS.md",
  "harness": "fixture-runner",
  "model": "deterministic-fixture",
  "workspace_id": "context-lift-ci",
  "pairs": [
    {
      "case_id": "explicit-routing",
      "kind": "explicit",
      "baseline": {"context_revision":"v1","scores":{"safety":1.0,"task_accuracy":0.72,"goal_completion":0.72,"instruction_adherence":0.72,"routing_quality":0.65,"context_efficiency":0.70},"usage":{"tokens":5000,"tool_calls":12,"duration_ms":9000}},
      "treatment": {"context_revision":"v2","scores":{"safety":1.0,"task_accuracy":0.84,"goal_completion":0.84,"instruction_adherence":0.88,"routing_quality":0.90,"context_efficiency":0.78},"usage":{"tokens":4700,"tool_calls":10,"duration_ms":8200}}
    },
    {
      "case_id": "implicit-policy",
      "kind": "implicit",
      "baseline": {"context_revision":"v1","scores":{"safety":0.90,"task_accuracy":0.70,"goal_completion":0.68,"instruction_adherence":0.70,"routing_quality":0.68,"context_efficiency":0.70},"usage":{"tokens":5200,"tool_calls":13,"duration_ms":9300}},
      "treatment": {"context_revision":"v2","scores":{"safety":0.95,"task_accuracy":0.82,"goal_completion":0.80,"instruction_adherence":0.85,"routing_quality":0.84,"context_efficiency":0.77},"usage":{"tokens":4900,"tool_calls":11,"duration_ms":8500}}
    },
    {
      "case_id": "contextual-capability",
      "kind": "contextual",
      "baseline": {"context_revision":"v1","scores":{"safety":0.95,"task_accuracy":0.73,"goal_completion":0.71,"instruction_adherence":0.74,"routing_quality":0.66,"context_efficiency":0.69},"usage":{"tokens":5600,"tool_calls":15,"duration_ms":10100}},
      "treatment": {"context_revision":"v2","scores":{"safety":0.95,"task_accuracy":0.83,"goal_completion":0.82,"instruction_adherence":0.86,"routing_quality":0.88,"context_efficiency":0.76},"usage":{"tokens":5100,"tool_calls":12,"duration_ms":9000}}
    },
    {
      "case_id": "negative-no-extra-routing",
      "kind": "negative",
      "baseline": {"context_revision":"v1","scores":{"safety":1.0,"task_accuracy":0.90,"goal_completion":0.90,"instruction_adherence":0.88,"routing_quality":0.85,"context_efficiency":0.82},"usage":{"tokens":1800,"tool_calls":2,"duration_ms":2500}},
      "treatment": {"context_revision":"v2","scores":{"safety":1.0,"task_accuracy":0.92,"goal_completion":0.92,"instruction_adherence":0.91,"routing_quality":0.90,"context_efficiency":0.85},"usage":{"tokens":1750,"tool_calls":2,"duration_ms":2400}}
    }
  ]
}
